,Generator Name,HOST TO,Plant Type,Gen_Type,Ranking,Apportion,bus_id,MW Effective - Import,MW Effective - Export,Force MW Dispatch,Max Dispatchable,MW Dispatch
0,Viking Link Denmark Interconnector (NATIONAL GRID VIKING LINK LIMITED),NGET,Interconnector,Interconnector,0.0,1;0;-0.5,[8],1500.0,1500.0,0.0,"[1500.0, 0.0, -750.0]","[1500.0, 0.0, -750.0]"
1,The Superconnection (ASC ENERGY LIMITED),NGET,Interconnector,Interconnector,0.0,1;0;-0.5,"[53, 119]",1000.0,1000.0,0.0,"[1000.0, 0.0, -500.0]","[1000.0, 0.0, -500.0]"
2,Aquind Interconnector (AQUIND LIMITED),NGET,Interconnector,Interconnector,0.0,1;0;-0.5,[107],2000.0,2075.0,0.0,"[2000.0, 0.0, -1037.5]","[2000.0, 0.0, -1037.5]"
3,Britned (BRITNED DEVELOPMENT LIMITED),NGET,Interconnector,Interconnector,0.0,1;0;-0.5,[235],1200.0,1200.0,0.0,"[1200.0, 0.0, -600.0]","[1200.0, 0.0, -600.0]"
4,East West Interconnector (EIRGRID INTERCONNECTOR DESIGNATED ACTIVITY COMPANY),NGET,Interconnector,Interconnector,0.0,1;0;-0.5,[113],505.0,585.0,0.0,"[505.0, 0.0, -292.5]","[505.0, 0.0, -292.5]"
5,ElecLink (ELECLINK LIMITED),NGET,Interconnector,Interconnector,0.0,1;0;-0.5,"[86, 214, 251, 252, 284, 313]",1000.0,1050.0,0.0,"[1000.0, 0.0, -525.0]","[1000.0, 0.0, -525.0]"
6,FAB Link Interconnector (FAB LINK LIMITED),NGET,Interconnector,Interconnector,0.0,1;0;-0.5,[92],1250.0,1310.0,0.0,"[1250.0, 0.0, -655.0]","[1250.0, 0.0, -655.0]"
7,Greenlink (GREENLINK INTERCONNECTOR LIMITED),NGET,Interconnector,Interconnector,0.0,1;0;-0.5,[156],504.0,524.0,0.0,"[504.0, 0.0, -262.0]","[504.0, 0.0, -262.0]"
8,IFA Interconnector (NATIONAL GRID INTERCONNECTORS LIMITED),NGET,Interconnector,Interconnector,0.0,1;0;-0.5,"[86, 214, 251, 252, 284, 313]",1988.0,1988.0,0.0,"[1988.0, 0.0, -994.0]","[1988.0, 0.0, -994.0]"
9,IFA2 Interconnector (NATIONAL GRID IFA 2 LIMITED),NGET,Interconnector,Interconnector,0.0,1;0;-0.5,[282],1100.0,1150.0,0.0,"[1100.0, 0.0, -575.0]","[1100.0, 0.0, -575.0]"
10,Isle of Man Interconnector (MANX UTILITIES),NGET,Interconnector,Interconnector,0.0,1;0;-0.5,"[339, 420, 428, 464]",74.0,74.0,0.0,"[74.0, 0.0, -37.0]","[74.0, 0.0, -37.0]"
11,Continental Link (NATIONAL GRID INTERCONNECTOR HOLDINGS LIMITED),NGET,Interconnector,Interconnector,0.0,1;0;-0.5,"[53, 119]",1800.0,1800.0,0.0,"[1800.0, 0.0, -900.0]","[1800.0, 0.0, -900.0]"
12,Lion (EuroLink) (NATIONAL GRID INTERCONNECTOR HOLDINGS LIMITED),NGET,Interconnector,Interconnector,0.0,1;0;-0.5,"[48, 99, 162, 231, 262]",1600.0,1600.0,0.0,"[1600.0, 0.0, -800.0]","[1600.0, 0.0, -800.0]"
13,NeuConnect Interconnector (NEUCONNECT BRITAIN LTD),NGET,Interconnector,Interconnector,0.0,1;0;-0.5,"[90, 178, 191, 257]",1400.0,1470.0,0.0,"[1400.0, 0.0, -735.0]","[1400.0, 0.0, -735.0]"
14,MARES (MARESCONNECT LIMITED),NGET,Interconnector,Interconnector,0.0,1;0;-0.5,[298],750.0,750.0,0.0,"[750.0, 0.0, -375.0]","[750.0, 0.0, -375.0]"
15,NS Link (NATIONAL GRID NORTH SEA LINK LIMITED),NGET,Interconnector,Interconnector,0.0,1;0;-0.5,[314],1400.0,1480.0,0.0,"[1400.0, 0.0, -740.0]","[1400.0, 0.0, -740.0]"
16,Nautilus (NATIONAL GRID INTERCONNECTOR HOLDINGS LIMITED),NGET,Interconnector,Interconnector,0.0,1;0;-0.5,[95],1500.0,1500.0,0.0,"[1500.0, 0.0, -750.0]","[1500.0, 0.0, -750.0]"
17,Nemo Link (NEMO LINK LIMITED),NGET,Interconnector,Interconnector,0.0,1;0;-0.5,[164],1020.0,1046.0,0.0,"[1020.0, 0.0, -523.0]","[1020.0, 0.0, -523.0]"
18,Kulizumboo Interconnector (KULIZUMBOO LIMITED),NGET,Interconnector,Interconnector,0.0,1;0;-0.5,[152],700.0,700.0,0.0,"[700.0, 0.0, -350.0]","[700.0, 0.0, -350.0]"
19,East Anglia One North (EAST ANGLIA ONE LIMITED),NGET,Wind Offshore,Wind,1.0,1;1;1,"[48, 99, 162, 231, 262]",860.0,0.0,0.0,"[860.0, 860.0, 860.0]","[122.3, 576.0, 808.1]"
20,East Anglia One (EAST ANGLIA ONE LIMITED),NGET,Wind Offshore,Wind,1.0,1;1;1,"[48, 99, 162, 231, 262]",680.0,0.0,0.0,"[680.0, 680.0, 680.0]","[96.7, 455.5, 638.9]"
21,Dudgeon Offshore Wind Farm (DUDGEON OFFSHORE WIND LIMITED),NGET,Wind Offshore,Wind,1.0,1;1;1,"[97, 190, 246]",400.0,0.0,0.0,"[400.0, 400.0, 400.0]","[56.9, 267.9, 375.8]"
22,Merlin Offshore Wind Farm (OFFSHORE WIND LIMITED),NGET,Wind Offshore,Wind,1.0,1;1;1,"[64, 217]",300.0,0.0,0.0,"[300.0, 300.0, 300.0]","[42.7, 200.9, 281.9]"
23,Dogger Bank Project C (DOGGERBANK OFFSHORE WIND FARM PROJECT 3 PROJCO LIMITED),NGET,Wind Offshore,Wind,1.0,1;1;1,[286],1200.0,0.0,0.0,"[1200.0, 1200.0, 1200.0]","[170.7, 803.8, 1127.5]"
24,Dogger Bank Project A (DOGGERBANK OFFSHORE WIND FARM PROJECT 1 PROJCO LIMITED),NGET,Wind Offshore,Wind,1.0,1;1;1,"[53, 119]",1200.0,0.0,0.0,"[1200.0, 1200.0, 1200.0]","[170.7, 803.8, 1127.5]"
25,Dogger Bank Project 4 (Dogger Bank B) (DOGGERBANK OFFSHORE WIND FARM PROJECT 2 PROJCO LIMITED),NGET,Wind Offshore,Wind,1.0,1;1;1,"[53, 119]",1200.0,0.0,0.0,"[1200.0, 1200.0, 1200.0]","[170.7, 803.8, 1127.5]"
26,Ormonde Offshore Wind Farm (ORMONDE ENERGY LIMITED),OFTO,Wind Offshore,Wind,1.0,1;1;1,[570],150.0,0.0,0.0,"[150.0, 150.0, 150.0]","[21.3, 100.5, 140.9]"
27,Peak Gen Makro Exeter (PEAK GEN POWER 14 LIMITED),NGET,Reactive Compensation,Other,1.0,1;1;1,[755],20.0,0.0,0.0,"[20.0, 20.0, 20.0]","[2.8, 13.4, 18.8]"
28,Rampion Offshore Wind Farm (RAMPION OFFSHORE WIND LIMITED),NGET,Wind Offshore,Wind,1.0,1;1;1,[259],400.0,0.0,0.0,"[400.0, 400.0, 400.0]","[56.9, 267.9, 375.8]"
29,Rampion Extension Offshore Wind Farm (RAMPION EXTENSION DEVELOPMENT LIMITED),NGET,Wind Offshore,Wind,1.0,1;1;1,[259],1200.0,0.0,0.0,"[1200.0, 1200.0, 1200.0]","[170.7, 803.8, 1127.5]"
30,Robin Rigg East Offshore Wind Farm (RWE RENEWABLES UK ROBIN RIGG EAST LIMITED),OFTO,Wind Offshore,Wind,1.0,1;1;1,"[659, 660, 662]",86.0,0.0,0.0,"[86.0, 86.0, 86.0]","[12.2, 57.6, 80.8]"
31,Robin Rigg West Offshore Wind Farm (RWE RENEWABLES UK ROBIN RIGG WEST LIMITED),OFTO,Wind Offshore,Wind,1.0,1;1;1,"[659, 660, 662]",92.0,0.0,0.0,"[92.0, 92.0, 92.0]","[13.1, 61.6, 86.4]"
32,Codling Park Wind Farm (CODLING WIND PARK III LIMITED),NGET,Wind Offshore,Wind,1.0,1;1;1,[293],1000.0,0.0,0.0,"[1000.0, 1000.0, 1000.0]","[142.3, 669.8, 939.6]"
33,Sheringham Shoal Offshore Wind Farm (SCIRA OFFSHORE ENERGY LIMITED),OFTO,Wind Offshore,Wind,1.0,1;1;1,"[537, 596, 645, 741]",315.0,0.0,0.0,"[315.0, 315.0, 315.0]","[44.8, 211.0, 296.0]"
34,East Anglia Three *Stage: 1.0* (EAST ANGLIA THREE LIMITED),NGET,Wind Offshore,Wind,1.0,1;1;1,"[222, 237]",1200.0,0.0,0.0,"[1200.0, 1200.0, 1200.0]","[170.7, 803.8, 1127.5]"
35,Sellindge Grid Stability Services (SELLINDGE GRID SERVICES LIMITED),NGET,Reactive Compensation,Other,1.0,1;1;1,"[86, 214, 251, 252, 284, 313]",0.0,0.0,0.0,"[0.0, 0.0, 0.0]","[0.0, 0.0, 0.0]"
36,Cilfynydd Grid Stability Services (WP GRID SERVICES 18 LIMITED),NGET,Reactive Compensation,Other,1.0,1;1;1,[137],0.0,0.0,0.0,"[0.0, 0.0, 0.0]","[0.0, 0.0, 0.0]"
37,Scira-Dudgeon Extension *Stage: 1.0* (EQUINOR NEW ENERGY LIMITED),NGET,Wind Offshore,Wind,1.0,1;1;1,[169],719.0,0.0,0.0,"[719.0, 719.0, 719.0]","[102.3, 481.6, 675.6]"
38,Gwynt Y Mor Offshore Wind Farm (GWYNT Y MOR OFFSHORE WIND FARM LIMITED),OFTO,Wind Offshore,Wind,1.0,1;1;1,[298],574.0,0.0,0.0,"[574.0, 574.0, 574.0]","[81.7, 384.5, 539.3]"
39,East Anglia Three *Stage: 2.0* (EAST ANGLIA THREE LIMITED),NGET,Wind Offshore,Wind,1.0,1;1;1,"[222, 237]",100.0,0.0,0.0,"[100.0, 100.0, 100.0]","[14.2, 67.0, 94.0]"
40,Hornsea Power Station 4 *Stage: 2.0* (ORSTED HORNSEA PROJECT FOUR LIMITED),NGET,Wind Offshore,Wind,1.0,1;1;1,"[53, 119]",1100.0,0.0,0.0,"[1100.0, 1100.0, 1100.0]","[156.5, 736.8, 1033.6]"
41,London Array Offshore Wind Farm (LONDON ARRAY LIMITED),OFTO,Wind Offshore,Wind,1.0,1;1;1,[143],630.0,0.0,0.0,"[630.0, 630.0, 630.0]","[89.6, 422.0, 592.0]"
42,Gunfleet Sands Offshore Wind Farm (GUNFLEET SANDS LIMITED),OFTO,Wind Offshore,Wind,1.0,1;1;1,"[616, 731]",99.9,0.0,0.0,"[99.9, 99.9, 99.9]","[14.2, 66.9, 93.9]"
43,Gunfleet Sands II Offshore Wind Farm (Gunfleet Sands II Ltd),OFTO,Wind Offshore,Wind,1.0,1;1;1,"[616, 731]",64.0,0.0,0.0,"[64.0, 64.0, 64.0]","[9.1, 42.9, 60.1]"
44,Hornsea Power Station 1A (HORNSEA 1 LIMITED),NGET,Wind Offshore,Wind,1.0,1;1;1,[118],400.0,0.0,0.0,"[400.0, 400.0, 400.0]","[56.9, 267.9, 375.8]"
45,Hornsea Power Station 1B (HORNSEA 1 LIMITED),NGET,Wind Offshore,Wind,1.0,1;1;1,[118],400.0,0.0,0.0,"[400.0, 400.0, 400.0]","[56.9, 267.9, 375.8]"
46,Greater Gabbard Offshore Wind Farm (GREATER GABBARD OFFSHORE WINDS LIMITED),OFTO,Wind Offshore,Wind,1.0,1;1;1,[606],500.0,0.0,0.0,"[500.0, 500.0, 500.0]","[71.1, 334.9, 469.8]"
47,Hornsea Power Station 1C (HORNSEA 1 LIMITED),NGET,Wind Offshore,Wind,1.0,1;1;1,[118],400.0,0.0,0.0,"[400.0, 400.0, 400.0]","[56.9, 267.9, 375.8]"
48,Hornsea Power Station 2A (BREESEA LIMITED),NGET,Wind Offshore,Wind,1.0,1;1;1,[118],440.0,0.0,0.0,"[440.0, 440.0, 440.0]","[62.6, 294.7, 413.4]"
49,Hornsea Power Station 2B (SOUNDMARK WIND LIMITED),NGET,Wind Offshore,Wind,1.0,1;1;1,[118],440.0,0.0,0.0,"[440.0, 440.0, 440.0]","[62.6, 294.7, 413.4]"
50,Hornsea Power Station 2C (SONNINGMAY WIND LIMITED),NGET,Wind Offshore,Wind,1.0,1;1;1,[118],440.0,0.0,0.0,"[440.0, 440.0, 440.0]","[62.6, 294.7, 413.4]"
51,Hornsea Power Station 3 *Stage: 1.0* (ORSTED HORNSEA PROJECT THREE (UK) LIMITED),NGET,Wind Offshore,Wind,1.0,1;1;1,[169],2250.0,0.0,0.0,"[2250.0, 2250.0, 2250.0]","[320.1, 1507.1, 2114.1]"
52,Hornsea Power Station 3 *Stage: 2.0* (ORSTED HORNSEA PROJECT THREE (UK) LIMITED),NGET,Wind Offshore,Wind,1.0,1;1;1,[169],750.0,0.0,0.0,"[750.0, 750.0, 750.0]","[106.7, 502.4, 704.7]"
53,Galloper Wind Farm (GALLOPER WIND FARM LIMITED),NGET,Wind Offshore,Wind,1.0,1;1;1,[606],348.0,0.0,0.0,"[348.0, 348.0, 348.0]","[49.5, 233.1, 327.0]"
54,Hornsea Power Station 4 *Stage: 1.0* (ORSTED HORNSEA PROJECT FOUR LIMITED),NGET,Wind Offshore,Wind,1.0,1;1;1,"[53, 119]",1500.0,0.0,0.0,"[1500.0, 1500.0, 1500.0]","[213.4, 1004.7, 1409.4]"
55,Sofia Offshore Wind Farm *Stage: 1.0* (SOFIA OFFSHORE WIND FARM LIMITED),NGET,Wind Offshore,Wind,1.0,1;1;1,"[53, 119]",132.0,0.0,0.0,"[132.0, 132.0, 132.0]","[18.8, 88.4, 124.0]"
56,Humber Gateway Offshore Wind Farm (RWE RENEWABLES UK HUMBER WIND LIMITED),OFTO,Wind Offshore,Wind,1.0,1;1;1,[346],220.0,0.0,0.0,"[220.0, 220.0, 220.0]","[31.3, 147.4, 206.7]"
57,Icewind Hinkley Point (Hecate Offshore Wind Limited),NGET,Wind Offshore,Wind,1.0,1;1;1,[75],1000.0,0.0,0.0,"[1000.0, 1000.0, 1000.0]","[142.3, 669.8, 939.6]"
58,Lincs Offshore Wind Farm (LINCS WIND FARM LIMITED),OFTO,Wind Offshore,Wind,1.0,1;1;1,[36],265.0,0.0,0.0,"[265.0, 265.0, 265.0]","[37.7, 177.5, 249.0]"
59,Erebus (BLUE GEM WIND LIMITED),NGET,Wind Offshore,Wind,1.0,1;1;1,[668],91.0,0.0,0.0,"[91.0, 91.0, 91.0]","[12.9, 61.0, 85.5]"
60,Lister Drive 275kV (LISTER DRIVE SOLUTIONS LIMITED),NGET,Reactive Compensation,Other,1.0,1;1;1,"[405, 483]",0.0,0.0,0.0,"[0.0, 0.0, 0.0]","[0.0, 0.0, 0.0]"
61,East Anglia Two (EAST ANGLIA TWO LIMITED),NGET,Wind Offshore,Wind,1.0,1;1;1,"[48, 99, 162, 231, 262]",860.0,0.0,0.0,"[860.0, 860.0, 860.0]","[122.3, 576.0, 808.1]"
62,Sofia Offshore Wind Farm *Stage: 2.0* (SOFIA OFFSHORE WIND FARM LIMITED),NGET,Wind Offshore,Wind,1.0,1;1;1,"[53, 119]",1188.0,0.0,0.0,"[1188.0, 1188.0, 1188.0]","[169.0, 795.7, 1116.3]"
63,Race Bank Wind Farm (RACE BANK WIND FARM LIMITED),NGET,Wind Offshore,Wind,1.0,1;1;1,[36],565.0,0.0,0.0,"[565.0, 565.0, 565.0]","[80.4, 378.4, 530.9]"
64,Triton Knoll Offshore Wind Farm (TRITON KNOLL OFFSHORE WIND FARM LIMITED),NGET,Wind Offshore,Wind,1.0,1;1;1,[8],824.0,0.0,0.0,"[824.0, 824.0, 824.0]","[117.2, 551.9, 774.2]"
65,Thanet Offshore Wind Farm (THANET OFFSHORE WIND LIMITED),OFTO,Wind Offshore,Wind,1.0,1;1;1,[715],300.0,0.0,0.0,"[300.0, 300.0, 300.0]","[42.7, 200.9, 281.9]"
66,TINZ Nene 4 (Richborough) (TINZ PROGRAMME 3 PROJECTCO 4 LIMITED),NGET,Reactive Compensation,Other,1.0,1;1;1,[164],0.0,0.0,0.0,"[0.0, 0.0, 0.0]","[0.0, 0.0, 0.0]"
67,TINZ Project Nene 1 (Landulph) (TINZ PROGRAMME 3 PROJECTCO 1 LIMITED),NGET,Reactive Compensation,Other,1.0,1;1;1,"[56, 280]",1.0,0.0,0.0,"[1.0, 1.0, 1.0]","[0.1, 0.7, 0.9]"
68,Vanguard (NORFOLK VANGUARD LIMITED),NGET,Wind Offshore,Wind,1.0,1;1;1,"[97, 190, 246]",1320.0,0.0,0.0,"[1320.0, 1320.0, 1320.0]","[187.8, 884.1, 1240.3]"
69,Burbo Bank Extension Offshore Wind Farm (BURBO EXTENSION LTD),NGET,Wind Offshore,Wind,1.0,1;1;1,[298],258.0,0.0,0.0,"[258.0, 258.0, 258.0]","[36.7, 172.8, 242.4]"
70,Tamar-Richborough (TI PROJECTCO 2 LIMITED),NGET,Reactive Compensation,Other,1.0,1;1;1,[164],0.0,0.0,0.0,"[0.0, 0.0, 0.0]","[0.0, 0.0, 0.0]"
71,Vanguard East *Stage: 1.0* (Norfolk Vanguard East Ltd),NGET,Wind Offshore,Wind,1.0,1;1;1,"[97, 190, 246]",400.0,0.0,0.0,"[400.0, 400.0, 400.0]","[56.9, 267.9, 375.8]"
72,Tamar-Landulph (TI PROJECTCO 1 LIMITED),NGET,Reactive Compensation,Other,1.0,1;1;1,"[56, 280]",0.0,0.0,0.0,"[0.0, 0.0, 0.0]","[0.0, 0.0, 0.0]"
73,Vanguard East *Stage: 2.0* (Norfolk Vanguard East Ltd),NGET,Wind Offshore,Wind,1.0,1;1;1,"[97, 190, 246]",920.0,0.0,0.0,"[920.0, 920.0, 920.0]","[130.9, 616.2, 864.4]"
74,Walney 3 Offshore Wind Farm (WALNEY EXTENSION LIMITED),NGET,Wind Offshore,Wind,1.0,1;1;1,[71],330.0,0.0,0.0,"[330.0, 330.0, 330.0]","[46.9, 221.0, 310.1]"
75,Walney 4 Offshore Wind Farm (WALNEY EXTENSION LIMITED),NGET,Wind Offshore,Wind,1.0,1;1;1,[71],330.0,0.0,0.0,"[330.0, 330.0, 330.0]","[46.9, 221.0, 310.1]"
76,Tamar-Hartmoor (TI PROJECTCO 3 LIMITED),NGET,Reactive Compensation,Other,1.0,1;1;1,[473],0.0,0.0,0.0,"[0.0, 0.0, 0.0]","[0.0, 0.0, 0.0]"
77,Walney II Offshore Wind Farm (WALNEY (UK) OFFSHORE WINDFARMS LIMITED),OFTO,Wind Offshore,Wind,1.0,1;1;1,[71],182.0,0.0,0.0,"[182.0, 182.0, 182.0]","[25.9, 121.9, 171.0]"
78,Swansea Greener Grid Park - Connection 2 (Swansea Grid Solutions Limited),NGET,Reactive Compensation,BESS / Energy Park,1.0,1;1;1,"[74, 171, 196, 256]",0.0,0.0,0.0,"[0.0, 0.0, 0.0]","[0.0, 0.0, 0.0]"
79,Alverdiscott (XLINKS 1 LTD),NGET,Wind Offshore,Wind,1.0,1;1;1,"[64, 217]",1800.0,0.0,0.0,"[1800.0, 1800.0, 1800.0]","[256.1, 1205.6, 1691.3]"
80,Walpole Grid Services Facility (Conrad (Walpole) Limited),NGET,Reactive Compensation,Other,1.0,1;1;1,[36],0.0,0.0,0.0,"[0.0, 0.0, 0.0]","[0.0, 0.0, 0.0]"
81,Westermost Rough Offshore Wind Farm (WESTERMOST ROUGH LIMITED),OFTO,Wind Offshore,Wind,1.0,1;1;1,[346],206.5,0.0,0.0,"[206.5, 206.5, 206.5]","[29.4, 138.3, 194.0]"
82,West of Duddon Sands Offshore Wind Farm (MORECAMBE WIND LIMITED),OFTO,Wind Offshore,Wind,1.0,1;1;1,[218],382.0,0.0,0.0,"[382.0, 382.0, 382.0]","[54.3, 255.9, 358.9]"
83,Barrow Offshore Wind Farm (BARROW OFFSHORE WIND LIMITED),OFTO,Wind Offshore,Wind,1.0,1;1;1,"[659, 660, 662]",90.0,0.0,0.0,"[90.0, 90.0, 90.0]","[12.8, 60.3, 84.6]"
84,Awel Y Mor Extension *Stage: 2.0* (AWEL Y MOR OFFSHORE WIND FARM LIMITED),NGET,Wind Offshore,Wind,1.0,1;1;1,[298],526.0,0.0,0.0,"[526.0, 526.0, 526.0]","[74.8, 352.3, 494.2]"
85,Awel Y Mor Extension *Stage: 1.0* (AWEL Y MOR OFFSHORE WIND FARM LIMITED),NGET,Wind Offshore,Wind,1.0,1;1;1,[298],574.0,0.0,0.0,"[574.0, 574.0, 574.0]","[81.7, 384.5, 539.3]"
86,Walney I Offshore Wind Farm (WALNEY (UK) OFFSHORE WINDFARMS LIMITED),OFTO,Wind Offshore,Wind,1.0,1;1;1,[71],182.0,0.0,0.0,"[182.0, 182.0, 182.0]","[25.9, 121.9, 171.0]"
87,Menter Mon Morlais Anglesey Marine Energy *Stage: 1.0* (MENTER MON CYF),NGET,Tidal,Hydro/Pump/Tidal,2.0,1;1;1,[729],40.0,0.0,0.0,"[40.0, 40.0, 40.0]","[0, 0, 0]"
88,Port of Mostyn (MOSTYN SEAPOWER LIMITED),NGET,Tidal,Hydro/Pump/Tidal,2.0,1;1;1,[113],210.0,0.0,0.0,"[210.0, 210.0, 210.0]","[0, 0, 0]"
89,Dolgarrog (RWE GENERATION UK PLC),NGET,Hydro,Hydro/Pump/Tidal,3.0,1;1;1,[724],39.0,0.0,0.0,"[39.0, 39.0, 39.0]","[0, 0, 0]"
90,Cwm Dyli (RWE GENERATION UK PLC),NGET,Hydro,Hydro/Pump/Tidal,3.0,1;1;1,[361],10.0,0.0,0.0,"[10.0, 10.0, 10.0]","[0, 0, 0]"
91,Hinkley Point B (EDF ENERGY NUCLEAR GENERATION LIMITED),NGET,Nuclear,Nuclear,4.0,1;1;1,[75],1061.0,0.0,0.0,"[1061.0, 1061.0, 1061.0]","[0, 0, 0]"
92,Hinkley Point C *Stage: 2.0* (EDF ENERGY NUCLEAR GENERATION LIMITED),NGET,Nuclear,Nuclear,4.0,1;1;1,[75],1670.0,0.0,0.0,"[1670.0, 1670.0, 1670.0]","[0, 0, 0]"
93,Heysham Power Station (EDF ENERGY NUCLEAR GENERATION LIMITED),NGET,Nuclear,Nuclear,4.0,1;1;1,[570],2388.0,0.0,0.0,"[2388.0, 2388.0, 2388.0]","[0, 0, 0]"
94,Hinkley Point C *Stage: 1.0* (EDF ENERGY NUCLEAR GENERATION LIMITED),NGET,Nuclear,Nuclear,4.0,1;1;1,[75],1670.0,0.0,0.0,"[1670.0, 1670.0, 1670.0]","[0, 0, 0]"
95,Hartlepool (EDF ENERGY NUCLEAR GENERATION LIMITED),NGET,Nuclear,Nuclear,4.0,1;1;1,[370],1207.0,0.0,0.0,"[1207.0, 1207.0, 1207.0]","[0, 0, 0]"
96,Sizewell B (EDF ENERGY NUCLEAR GENERATION LIMITED),NGET,Nuclear,Nuclear,4.0,1;1;1,"[601, 669, 691, 698]",1230.0,0.0,0.0,"[1230.0, 1230.0, 1230.0]","[0, 0, 0]"
97,Moelfre Energy Park (MOELFRE ENERGY PARK LIMITED),NGET,Wind Onshore,Wind,5.0,1;1;1,[298],158.4,0.0,0.0,"[158.4, 158.4, 158.4]","[0, 0, 0]"
98,Little Hill (BRYN GILWERN ENERGY PARK LIMITED),NGET,Wind Onshore,Wind,5.0,1;1;1,"[74, 171, 196, 256]",74.9,0.0,0.0,"[74.9, 74.9, 74.9]","[0, 0, 0]"
99,BlaenCothi Energy Park (BLAENCOTHI ENERGY PARK LIMITED),NGET,Wind Onshore,Wind,5.0,1;1;1,"[74, 171, 196, 256]",145.0,0.0,0.0,"[145.0, 145.0, 145.0]","[0, 0, 0]"
100,Goole Fields Wind Farm (RWE RENEWABLES UK SWINDON LIMITED),NGET,Wind Onshore,Wind,5.0,1;1;1,"[150, 302]",32.0,0.0,0.0,"[32.0, 32.0, 32.0]","[0, 0, 0]"
101,Twyn Hywel Cillfynydd (Twyn Hywel Energy Park Ltd),NGET,Wind Onshore,Wind,5.0,1;1;1,[137],160.0,0.0,0.0,"[160.0, 160.0, 160.0]","[0, 0, 0]"
102,Lan Fawr Energy Park (LAN FAWR ENERGY PARK LIMITED),NGET,Wind Onshore,Wind,5.0,1;1;1,"[74, 171, 196, 256]",246.4,0.0,0.0,"[246.4, 246.4, 246.4]","[0, 0, 0]"
103,Tarenni (TARENNI ENERGY PARK LIMITED),NGET,Wind Onshore,Wind,5.0,1;1;1,[55],188.0,0.0,0.0,"[188.0, 188.0, 188.0]","[0, 0, 0]"
104,Nant Aman (NANT AMAN ENERGY PARK LIMITED),NGET,Wind Onshore,Wind,5.0,1;1;1,[55],143.0,0.0,0.0,"[143.0, 143.0, 143.0]","[0, 0, 0]"
105,Nant Ceiment Energy Park (NANT CEIMENT ENERGY PARK LIMITED),NGET,Wind Onshore,Wind,5.0,1;1;1,"[74, 171, 196, 256]",88.4,0.0,0.0,"[88.4, 88.4, 88.4]","[0, 0, 0]"
106,Builth Wells (ABEREDW ENERGY PARK LIMITED),NGET,Wind Onshore,Wind,5.0,1;1;1,"[74, 171, 196, 256]",133.0,0.0,0.0,"[133.0, 133.0, 133.0]","[0, 0, 0]"
107,Fron Goch (NANT MITHIL ENERGY PARK LIMITED),NGET,Wind Onshore,Wind,5.0,1;1;1,"[74, 171, 196, 256]",252.7,0.0,0.0,"[252.7, 252.7, 252.7]","[0, 0, 0]"
108,Eppynt Common (GARREG FAWR ENERGY PARK LIMITED),NGET,Wind Onshore,Wind,5.0,1;1;1,"[74, 171, 196, 256]",189.5,0.0,0.0,"[189.5, 189.5, 189.5]","[0, 0, 0]"
109,Pen Y Cymoedd Wind Farm (PEN Y CYMOEDD WIND FARM LIMITED),NGET,Wind Onshore,Wind,5.0,1;1;1,[55],228.0,0.0,0.0,"[228.0, 228.0, 228.0]","[0, 0, 0]"
110,Bryn Glas Energy Park (Bryn Glas Energy Park Limited),NGET,Wind Onshore,Wind,5.0,1;1;1,"[74, 171, 196, 256]",159.0,0.0,0.0,"[159.0, 159.0, 159.0]","[0, 0, 0]"
111,Gwynt Alwen WF (WIND 2 LIMITED),NGET,Wind Onshore,Wind,5.0,1;1;1,[785],108.0,0.0,0.0,"[108.0, 108.0, 108.0]","[0, 0, 0]"
112,Chatterley (CONRAD (CHATTERLEY) LIMITED),NGET,Gas Reciprocating,CCGT/CHP/Biomass,6.0,1;1;1,"[536, 688]",20.0,0.0,0.0,"[20.0, 20.0, 20.0]","[0, 0, 0]"
113,CPG Power (ESB ASSET DEVELOPMENT UK LIMITED),NGET,Gas Reciprocating,CCGT/CHP/Biomass,6.0,1;1;1,"[1, 88, 104, 239]",49.9,0.0,0.0,"[49.9, 49.9, 49.9]","[0, 0, 0]"
114,Grain North Power Station (GRAIN NORTH POWER LIMITED),NGET,Gas Reciprocating,CCGT/CHP/Biomass,6.0,1;1;1,[634],49.99,0.0,0.0,"[49.99, 49.99, 49.99]","[0, 0, 0]"
115,Grain South Power Station (Grain South Power Limited),NGET,Gas Reciprocating,CCGT/CHP/Biomass,6.0,1;1;1,[634],49.99,0.0,0.0,"[49.99, 49.99, 49.99]","[0, 0, 0]"
116,Peak Gen Fareham (PEAK GEN POWER 13 LIMITED),NGET,Gas Reciprocating,CCGT/CHP/Biomass,6.0,1;1;1,[713],21.0,0.0,0.0,"[21.0, 21.0, 21.0]","[0, 0, 0]"
117,Peak Gen Llandarcy (PEAK GEN POWER 5 LIMITED),NGET,Gas Reciprocating,CCGT/CHP/Biomass,6.0,1;1;1,"[74, 171, 196, 256]",21.0,0.0,0.0,"[21.0, 21.0, 21.0]","[0, 0, 0]"
118,VPI Immingham B OCGT (VPI IMMINGHAM B LIMITED),NGET,Gas Reciprocating,CCGT/CHP/Biomass,6.0,1;1;1,[308],299.0,0.0,0.0,"[299.0, 299.0, 299.0]","[0, 0, 0]"
119,Peak Gen Southampton (W4B RENEWABLE ENERGY LIMITED),NGET,Gas Reciprocating,CCGT/CHP/Biomass,6.0,1;1;1,[713],24.0,0.0,0.0,"[24.0, 24.0, 24.0]","[0, 0, 0]"
120,Middlewich BEGA (CONRAD (MIDDLEWICH) LIMITED),NGET,Gas Reciprocating,CCGT/CHP/Biomass,6.0,1;1;1,"[568, 780]",20.0,0.0,0.0,"[20.0, 20.0, 20.0]","[0, 0, 0]"
121,Kirkby *Stage: 1.0* (HD001KIR LTD),NGET,Gas Reciprocating,CCGT/CHP/Biomass,6.0,1;1;1,[523],49.9,0.0,0.0,"[49.9, 49.9, 49.9]","[0, 0, 0]"
122,Drax (Biomass) (DRAX POWER LIMITED),NGET,Biomass,CCGT/CHP/Biomass,7.0,1;1;1,"[150, 302]",1905.0,0.0,0.0,"[1905.0, 1905.0, 1905.0]","[0, 0, 0]"
123,Glanford (EPR GLANFORD LIMITED),NGET,Biomass,CCGT/CHP/Biomass,7.0,1;1;1,[648],15.0,0.0,0.0,"[15.0, 15.0, 15.0]","[0, 0, 0]"
124,Holyhead *Stage: 1.0* (Recell Energy Bloom Developments Limited),NGET,Biomass,CCGT/CHP/Biomass,7.0,1;1;1,[729],150.0,0.0,0.0,"[150.0, 150.0, 150.0]","[0, 0, 0]"
125,Burwell (ENERGY POWER RESOURCES LIMITED),NGET,Biomass,CCGT/CHP/Biomass,7.0,1;1;1,[626],38.0,0.0,0.0,"[38.0, 38.0, 38.0]","[0, 0, 0]"
126,Tilbury (TILBURY GREEN POWER LIMITED),NGET,Biomass,CCGT/CHP/Biomass,7.0,1;1;1,"[567, 643, 749, 759]",43.0,0.0,0.0,"[43.0, 43.0, 43.0]","[0, 0, 0]"
127,Thetford (EPR THETFORD LIMITED),NGET,Biomass,CCGT/CHP/Biomass,7.0,1;1;1,"[222, 237]",41.0,0.0,0.0,"[41.0, 41.0, 41.0]","[0, 0, 0]"
128,Tees Renewable Energy Plant (MGT TEESSIDE LIMITED),NGET,Biomass,CCGT/CHP/Biomass,7.0,1;1;1,"[338, 340, 447, 498]",285.0,0.0,0.0,"[285.0, 285.0, 285.0]","[0, 0, 0]"
129,Holyhead *Stage: 2.0* (Recell Energy Bloom Developments Limited),NGET,Biomass,CCGT/CHP/Biomass,7.0,1;1;1,[729],60.0,0.0,0.0,"[60.0, 60.0, 60.0]","[0, 0, 0]"
130,Lynemouth Power Station (LYNEMOUTH POWER LIMITED),NGET,Biomass,CCGT/CHP/Biomass,7.0,1;1;1,"[563, 627]",396.0,0.0,0.0,"[396.0, 396.0, 396.0]","[0, 0, 0]"
131,Huntworth (UK POWER RESERVE LIMITED),NGET,CCGT (Combined Cycle Gas Turbine),CCGT/CHP/Biomass,8.0,1;1;1,[667],10.0,0.0,0.0,"[10.0, 10.0, 10.0]","[0, 0, 0]"
132,Water Lane (VIRIDIS 178 LIMITED),NGET,CHP (Combined Heat and Power),CCGT/CHP/Biomass,8.0,1;1;1,[755],20.88,0.0,0.0,"[20.88, 20.88, 20.88]","[0, 0, 0]"
133,West Burton B (WEST BURTON B LIMITED),NGET,CCGT (Combined Cycle Gas Turbine); Energy Storage System,CCGT/CHP/Biomass,8.0,1;1;1,"[20, 203]",1333.0,0.0,0.0,"[1333.0, 1333.0, 1333.0]","[0, 0, 0]"
134,Sevington (UK POWER RESERVE LIMITED),NGET,CCGT (Combined Cycle Gas Turbine),CCGT/CHP/Biomass,8.0,1;1;1,"[575, 586, 686]",10.0,0.0,0.0,"[10.0, 10.0, 10.0]","[0, 0, 0]"
135,Severn Power (SEVERN POWER LIMITED),NGET,CCGT (Combined Cycle Gas Turbine),CCGT/CHP/Biomass,8.0,1;1;1,"[360, 391, 433]",850.0,0.0,0.0,"[850.0, 850.0, 850.0]","[0, 0, 0]"
136,Plymouth Rock (VIRIDIS 178 LIMITED),NGET,CHP (Combined Heat and Power),CCGT/CHP/Biomass,8.0,1;1;1,[663],15.08,0.0,0.0,"[15.08, 15.08, 15.08]","[0, 0, 0]"
137,SHBEC (EP SHB LIMITED),NGET,Waste,Other,8.0,1;1;1,[81],83.0,0.0,0.0,"[83.0, 83.0, 83.0]","[0, 0, 0]"
138,Derwent (UK UTILITY RESERVE LIMITED)_2,NGET,CHP (Combined Heat and Power),CCGT/CHP/Biomass,8.0,1;1;1,"[630, 647]",162.0,0.0,0.0,"[162.0, 162.0, 162.0]","[0, 0, 0]"
139,Immingham (VPI IMMINGHAM LLP)_2,NGET,CHP (Combined Heat and Power); Energy Storage System,CCGT/CHP/Biomass,8.0,1;1;1,[308],50.0,0.0,0.0,"[50.0, 50.0, 50.0]","[0, 0, 0]"
140,Keadby (KEADBY GENERATION LIMITED)_2,NGET,CCGT (Combined Cycle Gas Turbine),CCGT/CHP/Biomass,8.0,1;1;1,"[39, 73, 131, 155, 265, 279]",155.0,0.0,0.0,"[155.0, 155.0, 155.0]","[0, 0, 0]"
141,Medway Power Station (MEDWAY POWER LIMITED)_2,NGET,CCGT (Combined Cycle Gas Turbine),CCGT/CHP/Biomass,8.0,1;1;1,[235],175.0,0.0,0.0,"[175.0, 175.0, 175.0]","[0, 0, 0]"
142,Sellafield (NUCLEAR DECOMMISSIONING AUTHORITY),NGET,CHP (Combined Heat and Power),Nuclear,8.0,1;1;1,[730],155.0,0.0,0.0,"[155.0, 155.0, 155.0]","[0, 0, 0]"
143,Sutton Bridge (SUTTON BRIDGE POWER GENERATION),NGET,CCGT (Combined Cycle Gas Turbine),CCGT/CHP/Biomass,8.0,1;1;1,[36],850.0,0.0,0.0,"[850.0, 850.0, 850.0]","[0, 0, 0]"
144,Hirwaun Power Station (HIRWAUN POWER LIMITED),NGET,OCGT (Open Cycle Gas Turbine),CCGT/CHP/Biomass,8.0,1;1;1,[55],299.0,0.0,0.0,"[299.0, 299.0, 299.0]","[0, 0, 0]"
145,Shoreham (VPI POWER LIMITED),NGET,CCGT (Combined Cycle Gas Turbine),CCGT/CHP/Biomass,8.0,1;1;1,[259],420.0,0.0,0.0,"[420.0, 420.0, 420.0]","[0, 0, 0]"
146,Shoreham *Stage: 1.0* (VPI POWER LIMITED),NGET,CCGT (Combined Cycle Gas Turbine),CCGT/CHP/Biomass,8.0,1;1;1,[259],460.0,0.0,0.0,"[460.0, 460.0, 460.0]","[0, 0, 0]"
147,Shoreham *Stage: 2.0* (VPI POWER LIMITED),NGET,CCGT (Combined Cycle Gas Turbine),CCGT/CHP/Biomass,8.0,1;1;1,[259],-40.0,0.0,0.0,"[-40.0, -40.0, -40.0]","[0, 0, 0]"
148,Staythorpe C (RWE GENERATION UK PLC),NGET,CCGT (Combined Cycle Gas Turbine),CCGT/CHP/Biomass,8.0,1;1;1,"[102, 209]",1752.0,0.0,0.0,"[1752.0, 1752.0, 1752.0]","[0, 0, 0]"
149,Spalding (SPALDING ENERGY COMPANY LTD),NGET,CCGT (Combined Cycle Gas Turbine),CCGT/CHP/Biomass,8.0,1;1;1,[121],950.0,0.0,0.0,"[950.0, 950.0, 950.0]","[0, 0, 0]"
150,Wilton (SEMBCORP UTILITIES (UK) LIMITED),NGET,CCGT (Combined Cycle Gas Turbine),CCGT/CHP/Biomass,8.0,1;1;1,[525],141.0,0.0,0.0,"[141.0, 141.0, 141.0]","[0, 0, 0]"
151,Immingham (VPI IMMINGHAM LLP),NGET,CHP (Combined Heat and Power); Energy Storage System,CCGT/CHP/Biomass,8.0,1;1;1,[308],1218.0,0.0,0.0,"[1218.0, 1218.0, 1218.0]","[0, 0, 0]"
152,Langage (EP LANGAGE LIMITED),NGET,CCGT (Combined Cycle Gas Turbine),CCGT/CHP/Biomass,8.0,1;1;1,[28],905.0,0.0,0.0,"[905.0, 905.0, 905.0]","[0, 0, 0]"
153,JG Pears *Stage: 1.0* (JG PEARS GRID CONNECTION LIMITED),NGET,CHP (Combined Heat and Power),CCGT/CHP/Biomass,8.0,1;1;1,[327],13.0,0.0,0.0,"[13.0, 13.0, 13.0]","[0, 0, 0]"
154,Plymouth Main (VIRIDIS 178 LIMITED),NGET,CHP (Combined Heat and Power),CCGT/CHP/Biomass,8.0,1;1;1,[663],25.52,0.0,0.0,"[25.52, 25.52, 25.52]","[0, 0, 0]"
155,Powersite @ Drakelow (POWERSITE LTD),NGET,CCGT (Combined Cycle Gas Turbine),CCGT/CHP/Biomass,8.0,1;1;1,[253],380.0,0.0,0.0,"[380.0, 380.0, 380.0]","[0, 0, 0]"
156,Peterborough (RIVER NENE POWER LIMITED),NGET,CCGT (Combined Cycle Gas Turbine),CCGT/CHP/Biomass,8.0,1;1;1,[705],245.0,0.0,0.0,"[245.0, 245.0, 245.0]","[0, 0, 0]"
