,Generator Name,HOST TO,Plant Type,Gen_Type,Ranking,Apportion,bus_id,MW Effective - Import,MW Effective - Export,Force MW Dispatch,Max Dispatchable,MW Dispatch
157,Pembroke Power Station (RWE GENERATION UK PLC),NGET,CCGT (Combined Cycle Gas Turbine),CCGT/CHP/Biomass,8.0,1;1;1,[156],2199.0,0.0,0.0,"[2199.0, 2199.0, 2199.0]","[0, 0, 0]"
158,Norwich (ASHGREEN ENERGY FARM LIMITED),NGET,CCGT (Combined Cycle Gas Turbine),CCGT/CHP/Biomass,8.0,1;1;1,"[537, 596, 645, 741]",49.5,0.0,0.0,"[49.5, 49.5, 49.5]","[0, 0, 0]"
159,North Killingholme Power Project (C.GEN KILLINGHOLME LIMITED),NGET,CCGT (Combined Cycle Gas Turbine),CCGT/CHP/Biomass,8.0,1;1;1,[118],540.0,0.0,0.0,"[540.0, 540.0, 540.0]","[0, 0, 0]"
160,Net Zero Teesside Power Project (NET ZERO TEESSIDE POWER LIMITED),NGET,CCGT (Combined Cycle Gas Turbine),CCGT/CHP/Biomass,8.0,1;1;1,[337],860.0,0.0,0.0,"[860.0, 860.0, 860.0]","[0, 0, 0]"
161,Taylors Lane (UNIPER UK LIMITED),NGET,OCGT (Open Cycle Gas Turbine),CCGT/CHP/Biomass,8.0,1;1;1,[612],140.0,0.0,0.0,"[140.0, 140.0, 140.0]","[0, 0, 0]"
162,Millbrook Power (MILLBROOK POWER LIMITED),NGET,OCGT (Open Cycle Gas Turbine),CCGT/CHP/Biomass,8.0,1;1;1,"[46, 61, 63, 254]",299.0,0.0,0.0,"[299.0, 299.0, 299.0]","[0, 0, 0]"
163,Ratcliffe EMERGE (UNIPER UK LIMITED),NGET,Waste,Other,8.0,1;1;1,"[591, 766]",49.9,0.0,0.0,"[49.9, 49.9, 49.9]","[0, 0, 0]"
164,Redditch (CINERGY GLOBAL POWER (UK) LIMITED),NGET,CCGT (Combined Cycle Gas Turbine),CCGT/CHP/Biomass,8.0,1;1;1,[810],29.0,0.0,0.0,"[29.0, 29.0, 29.0]","[0, 0, 0]"
165,Trafford Power *Stage: 1.0* (WAINSTONES ENERGY LIMITED),NGET,CCGT (Combined Cycle Gas Turbine),CCGT/CHP/Biomass,8.0,1;1;1,"[1, 88, 104, 239]",1040.0,0.0,0.0,"[1040.0, 1040.0, 1040.0]","[0, 0, 0]"
166,South Humber Bank (EP SHB LIMITED),NGET,CCGT (Combined Cycle Gas Turbine),CCGT/CHP/Biomass,8.0,1;1;1,[81],1365.0,0.0,0.0,"[1365.0, 1365.0, 1365.0]","[0, 0, 0]"
167,Redfield Road A (VIRIDIS 178 LIMITED),NGET,CHP (Combined Heat and Power),CCGT/CHP/Biomass,8.0,1;1;1,"[591, 766]",20.88,0.0,0.0,"[20.88, 20.88, 20.88]","[0, 0, 0]"
168,Indian Queens (INDIAN QUEENS POWER LIMITED),NGET,OCGT (Open Cycle Gas Turbine),CCGT/CHP/Biomass,8.0,1;1;1,[175],140.0,0.0,0.0,"[140.0, 140.0, 140.0]","[0, 0, 0]"
169,Rocksavage (ROCKSAVAGE POWER COMPANY LTD),NGET,CCGT (Combined Cycle Gas Turbine),CCGT/CHP/Biomass,8.0,1;1;1,[146],810.0,0.0,0.0,"[810.0, 810.0, 810.0]","[0, 0, 0]"
170,Marchwood (MARCHWOOD POWER LIMITED),NGET,CCGT (Combined Cycle Gas Turbine),CCGT/CHP/Biomass,8.0,1;1;1,[211],920.0,0.0,0.0,"[920.0, 920.0, 920.0]","[0, 0, 0]"
171,Lynes Common (RWE COGEN UK (HYTHE) LIMITED),NGET,OCGT (Open Cycle Gas Turbine),CCGT/CHP/Biomass,8.0,1;1;1,[77],49.9,0.0,0.0,"[49.9, 49.9, 49.9]","[0, 0, 0]"
172,Rye House (VPI POWER LIMITED),NGET,CCGT (Combined Cycle Gas Turbine),CCGT/CHP/Biomass,8.0,1;1;1,"[603, 610, 773]",715.0,0.0,0.0,"[715.0, 715.0, 715.0]","[0, 0, 0]"
173,Little Barford (RWE GENERATION UK PLC),NGET,CCGT (Combined Cycle Gas Turbine),CCGT/CHP/Biomass,8.0,1;1;1,"[37, 106, 277]",740.0,0.0,0.0,"[740.0, 740.0, 740.0]","[0, 0, 0]"
174,Saltend (Saltend Cogeneration Company Ltd),NGET,CCGT (Combined Cycle Gas Turbine),CCGT/CHP/Biomass,8.0,1;1;1,[411],1100.0,0.0,0.0,"[1100.0, 1100.0, 1100.0]","[0, 0, 0]"
175,Seabank (SEABANK POWER LIMITED),NGET,CCGT (Combined Cycle Gas Turbine),CCGT/CHP/Biomass,8.0,1;1;1,"[47, 111]",1234.0,0.0,0.0,"[1234.0, 1234.0, 1234.0]","[0, 0, 0]"
176,Kings Lynn A (RWE GENERATION UK PLC),NGET,CCGT (Combined Cycle Gas Turbine),CCGT/CHP/Biomass,8.0,1;1;1,[705],395.0,0.0,0.0,"[395.0, 395.0, 395.0]","[0, 0, 0]"
177,Killingholme *Stage: 2.0* (UNIPER UK LIMITED),NGET,OCGT (Open Cycle Gas Turbine),CCGT/CHP/Biomass,8.0,1;1;1,[118],19.0,0.0,0.0,"[19.0, 19.0, 19.0]","[0, 0, 0]"
178,Killingholme *Stage: 1.0* (UNIPER UK LIMITED),NGET,OCGT (Open Cycle Gas Turbine),CCGT/CHP/Biomass,8.0,1;1;1,[118],600.0,0.0,0.0,"[600.0, 600.0, 600.0]","[0, 0, 0]"
179,Kemsley (GROVEHURST ENERGY LIMITED),NGET,CHP (Combined Heat and Power),CCGT/CHP/Biomass,8.0,1;1;1,[706],35.8,0.0,0.0,"[35.8, 35.8, 35.8]","[0, 0, 0]"
180,Keadby II (KEADBY GENERATION LIMITED),NGET,CCGT (Combined Cycle Gas Turbine),CCGT/CHP/Biomass,8.0,1;1;1,"[39, 73, 131, 155, 265, 279]",893.0,0.0,0.0,"[893.0, 893.0, 893.0]","[0, 0, 0]"
181,Keadby 3 (KEADBY GENERATION LIMITED),NGET,CCGT (Combined Cycle Gas Turbine),CCGT/CHP/Biomass,8.0,1;1;1,"[39, 73, 131, 155, 265, 279]",910.0,0.0,0.0,"[910.0, 910.0, 910.0]","[0, 0, 0]"
182,Keadby (KEADBY GENERATION LIMITED),NGET,CCGT (Combined Cycle Gas Turbine),CCGT/CHP/Biomass,8.0,1;1;1,"[39, 73, 131, 155, 265, 279]",755.0,0.0,0.0,"[755.0, 755.0, 755.0]","[0, 0, 0]"
183,JG Pears *Stage: 2.0* (JG PEARS GRID CONNECTION LIMITED),NGET,CHP (Combined Heat and Power),CCGT/CHP/Biomass,8.0,1;1;1,[327],17.0,0.0,0.0,"[17.0, 17.0, 17.0]","[0, 0, 0]"
184,Medway Power Station (MEDWAY POWER LIMITED),NGET,CCGT (Combined Cycle Gas Turbine),CCGT/CHP/Biomass,8.0,1;1;1,[235],735.0,0.0,0.0,"[735.0, 735.0, 735.0]","[0, 0, 0]"
185,Solutia (UK POWER RESERVE LIMITED),NGET,CCGT (Combined Cycle Gas Turbine),CCGT/CHP/Biomass,8.0,1;1;1,"[543, 590]",10.0,0.0,0.0,"[10.0, 10.0, 10.0]","[0, 0, 0]"
186,Abedare (UK POWER RESERVE LIMITED),NGET,CCGT (Combined Cycle Gas Turbine),CCGT/CHP/Biomass,8.0,1;1;1,[700],10.0,0.0,0.0,"[10.0, 10.0, 10.0]","[0, 0, 0]"
187,Corby (CORBY POWER LIMITED),NGET,CCGT (Combined Cycle Gas Turbine),CCGT/CHP/Biomass,8.0,1;1;1,"[566, 758]",401.0,0.0,0.0,"[401.0, 401.0, 401.0]","[0, 0, 0]"
188,Carrington Power Station (CARRINGTON POWER LIMITED),NGET,CCGT (Combined Cycle Gas Turbine),CCGT/CHP/Biomass,8.0,1;1;1,"[568, 780]",910.0,0.0,0.0,"[910.0, 910.0, 910.0]","[0, 0, 0]"
189,CDCL (UNIPER UK LIMITED),NGET,CCGT (Combined Cycle Gas Turbine),CCGT/CHP/Biomass,8.0,1;1;1,"[27, 62]",445.0,0.0,0.0,"[445.0, 445.0, 445.0]","[0, 0, 0]"
190,Damhead Creek (VPI POWER LIMITED),NGET,CCGT (Combined Cycle Gas Turbine),CCGT/CHP/Biomass,8.0,1;1;1,[594],812.0,0.0,0.0,"[812.0, 812.0, 812.0]","[0, 0, 0]"
191,Beech Street/City Road (CITIGEN (LONDON) LIMITED),NGET,CHP (Combined Heat and Power),CCGT/CHP/Biomass,8.0,1;1;1,"[553, 571]",30.0,0.0,0.0,"[30.0, 30.0, 30.0]","[0, 0, 0]"
192,Ferrybridge D *Stage: 1.0* (KEADBY GENERATION LIMITED),NGET,CCGT (Combined Cycle Gas Turbine); Energy Storage System; OCGT (Open Cycle Gas Turbine),CCGT/CHP/Biomass,8.0,1;1;1,"[350, 453, 468, 489, 491]",310.0,0.0,0.0,"[310.0, 310.0, 310.0]","[0, 0, 0]"
193,Damhead Creek 2 (VPI POWER LIMITED),NGET,CCGT (Combined Cycle Gas Turbine); Energy Storage System; OCGT (Open Cycle Gas Turbine),CCGT/CHP/Biomass,8.0,1;1;1,[21],1800.0,0.0,0.0,"[1800.0, 1800.0, 1800.0]","[0, 0, 0]"
194,Cheshire (RWE GENERATION UK PLC),NGET,OCGT (Open Cycle Gas Turbine),CCGT/CHP/Biomass,8.0,1;1;1,[502],90.0,0.0,0.0,"[90.0, 90.0, 90.0]","[0, 0, 0]"
195,Brigg (CBS ENERGY STORAGE ASSETS UK LIMITED),NGET,CCGT (Combined Cycle Gas Turbine),CCGT/CHP/Biomass,8.0,1;1;1,"[39, 73, 131, 155, 265, 279]",99.0,0.0,0.0,"[99.0, 99.0, 99.0]","[0, 0, 0]"
196,Barton Hill (VIRIDIS 178 LIMITED),NGET,CHP (Combined Heat and Power),CCGT/CHP/Biomass,8.0,1;1;1,"[637, 736]",20.88,0.0,0.0,"[20.88, 20.88, 20.88]","[0, 0, 0]"
197,Fawley CHP (ESSO PETROLEUM COMPANY LIMITED),NGET,CHP (Combined Heat and Power),CCGT/CHP/Biomass,8.0,1;1;1,[77],158.0,0.0,0.0,"[158.0, 158.0, 158.0]","[0, 0, 0]"
198,Chickerell (SSE GENERATION LIMITED),NGET,CHP (Combined Heat and Power),CCGT/CHP/Biomass,8.0,1;1;1,"[65, 241]",47.0,0.0,0.0,"[47.0, 47.0, 47.0]","[0, 0, 0]"
199,Derwent (UK UTILITY RESERVE LIMITED),NGET,CHP (Combined Heat and Power),CCGT/CHP/Biomass,8.0,1;1;1,"[630, 647]",0.0,0.0,0.0,"[0.0, 0.0, 0.0]","[0, 0, 0]"
200,Didcot A GTs (RWE GENERATION UK PLC),NGET,OCGT (Open Cycle Gas Turbine),CCGT/CHP/Biomass,8.0,1;1;1,[157],100.0,0.0,0.0,"[100.0, 100.0, 100.0]","[0, 0, 0]"
201,Didcot B (RWE GENERATION UK PLC),NGET,CCGT (Combined Cycle Gas Turbine),CCGT/CHP/Biomass,8.0,1;1;1,[157],1475.0,0.0,0.0,"[1475.0, 1475.0, 1475.0]","[0, 0, 0]"
202,Cowes (RWE GENERATION UK PLC),NGET,OCGT (Open Cycle Gas Turbine),CCGT/CHP/Biomass,8.0,1;1;1,[77],140.0,0.0,0.0,"[140.0, 140.0, 140.0]","[0, 0, 0]"
203,Eggborough CCGT and BESS (EGGBOROUGH POWER LIMITED),NGET,CCGT (Combined Cycle Gas Turbine); Energy Storage System; OCGT (Open Cycle Gas Turbine),CCGT/CHP/Biomass,8.0,1;1;1,"[5, 189]",2450.0,0.0,0.0,"[2450.0, 2450.0, 2450.0]","[0, 0, 0]"
204,Green Frog @ Rake Lane (VIRIDIS 178 LIMITED),NGET,CCGT (Combined Cycle Gas Turbine),CCGT/CHP/Biomass,8.0,1;1;1,[540],21.0,0.0,0.0,"[21.0, 21.0, 21.0]","[0, 0, 0]"
205,Green frog @ The Drove (VIRIDIS 178 LIMITED),NGET,OCGT (Open Cycle Gas Turbine),CCGT/CHP/Biomass,8.0,1;1;1,"[57, 192, 202, 271, 320]",6.0,0.0,0.0,"[6.0, 6.0, 6.0]","[0, 0, 0]"
206,Green Frog at Lester Way (VIRIDIS 178 LIMITED),NGET,OCGT (Open Cycle Gas Turbine),CCGT/CHP/Biomass,8.0,1;1;1,"[538, 738]",12.0,0.0,0.0,"[12.0, 12.0, 12.0]","[0, 0, 0]"
207,Green Frog @ Moorfield Drive (VIRIDIS 178 LIMITED),NGET,CCGT (Combined Cycle Gas Turbine),CCGT/CHP/Biomass,8.0,1;1;1,[650],21.0,0.0,0.0,"[21.0, 21.0, 21.0]","[0, 0, 0]"
208,Enfield (UNIPER UK LIMITED),NGET,CCGT (Combined Cycle Gas Turbine),CCGT/CHP/Biomass,8.0,1;1;1,[646],442.0,0.0,0.0,"[442.0, 442.0, 442.0]","[0, 0, 0]"
209,Green Frog @ Letchworth (VIRIDIS 178 LIMITED),NGET,OCGT (Open Cycle Gas Turbine),CCGT/CHP/Biomass,8.0,1;1;1,[779],15.0,0.0,0.0,"[15.0, 15.0, 15.0]","[0, 0, 0]"
210,Green Frog @ Down Barn Farm (VIRIDIS 178 LIMITED),NGET,CCGT (Combined Cycle Gas Turbine),CCGT/CHP/Biomass,8.0,1;1;1,[107],20.0,0.0,0.0,"[20.0, 20.0, 20.0]","[0, 0, 0]"
211,Green Frog @ Goose House Lane (VIRIDIS 178 LIMITED),NGET,CCGT (Combined Cycle Gas Turbine),CCGT/CHP/Biomass,8.0,1;1;1,"[684, 767]",21.0,0.0,0.0,"[21.0, 21.0, 21.0]","[0, 0, 0]"
212,Great Yarmouth (RWE GENERATION UK PLC),NGET,CCGT (Combined Cycle Gas Turbine),CCGT/CHP/Biomass,8.0,1;1;1,"[537, 596, 645, 741]",420.0,0.0,0.0,"[420.0, 420.0, 420.0]","[0, 0, 0]"
213,Grain (UNIPER UK LIMITED),NGET,CCGT (Combined Cycle Gas Turbine); Reactive Compensation,CCGT/CHP/Biomass,8.0,1;1;1,[235],1517.0,0.0,0.0,"[1517.0, 1517.0, 1517.0]","[0, 0, 0]"
214,Connahs Quay (UNIPER UK LIMITED),NGET,CCGT (Combined Cycle Gas Turbine),CCGT/CHP/Biomass,8.0,1;1;1,[113],1380.0,0.0,0.0,"[1380.0, 1380.0, 1380.0]","[0, 0, 0]"
215,Green Frog @ Alcoa (VIRIDIS 178 LIMITED),NGET,OCGT (Open Cycle Gas Turbine),CCGT/CHP/Biomass,8.0,1;1;1,"[635, 743]",40.0,0.0,0.0,"[40.0, 40.0, 40.0]","[0, 0, 0]"
216,Coryton (CORYTON ENERGY COMPANY LTD),NGET,CCGT (Combined Cycle Gas Turbine),CCGT/CHP/Biomass,8.0,1;1;1,[219],800.0,0.0,0.0,"[800.0, 800.0, 800.0]","[0, 0, 0]"
217,Cowley Energy Storage (Penso Power Limited),NGET,Energy Storage System,BESS / Energy Park,9.0,1;1;1,[207],200.0,0.0,0.0,"[200.0, 200.0, 200.0]","[0, 0, 0]"
218,Pond Hill Farm 2 BESS (PD688IRO LTD),NGET,Energy Storage System,BESS / Energy Park,9.0,1;1;1,[158],47.5,0.0,0.0,"[47.5, 47.5, 47.5]","[0, 0, 0]"
219,Cryogenic Battery System (Synchronous) (CRYOBATTERY ONE LIMITED),NGET,Energy Storage System; Reactive Compensation,BESS / Energy Park,9.0,1;1;1,"[1, 88, 104, 239]",49.9,0.0,0.0,"[49.9, 49.9, 49.9]","[0, 0, 0]"
220,Richborough 1 (RICHBOROUGH ENERGY PARK LIMITED),NGET,Energy Storage System,BESS / Energy Park,9.0,1;1;1,[164],50.0,0.0,0.0,"[50.0, 50.0, 50.0]","[0, 0, 0]"
221,Uskmouth *Stage: 1.0* (USKMOUTH ENERGY STORAGE LIMITED),NGET,Energy Storage System,BESS / Energy Park,9.0,1;1;1,"[543, 590]",230.0,0.0,0.0,"[230.0, 230.0, 230.0]","[0, 0, 0]"
222,Bramford (Tertiary) (PIVOTED POWER LLP),NGET,Energy Storage System,BESS / Energy Park,9.0,1;1;1,"[222, 237]",57.0,0.0,0.0,"[57.0, 57.0, 57.0]","[0, 0, 0]"
223,Bramley BESS *Stage: 1.0* (BRAMLEY BESS LIMITED),NGET,Energy Storage System,BESS / Energy Park,9.0,1;1;1,[310],49.995,0.0,0.0,"[49.995, 49.995, 49.995]","[0, 0, 0]"
224,Pond Hill Farm 1 (PD688IRO LTD),NGET,Energy Storage System,BESS / Energy Park,9.0,1;1;1,[158],47.5,0.0,0.0,"[47.5, 47.5, 47.5]","[0, 0, 0]"
225,Coventry (PIVOTED POWER LLP),NGET,Energy Storage System,BESS / Energy Park,9.0,1;1;1,[413],49.9,0.0,0.0,"[49.9, 49.9, 49.9]","[0, 0, 0]"
226,Uskmouth - New Connection (ENSO GREEN HOLDINGS E LIMITED),NGET,Energy Storage System,BESS / Energy Park,9.0,1;1;1,"[360, 391, 433]",120.0,0.0,0.0,"[120.0, 120.0, 120.0]","[0, 0, 0]"
227,Braintree (PIVOTED POWER LLP),NGET,Energy Storage System,BESS / Energy Park,9.0,1;1;1,"[15, 148]",49.9,0.0,0.0,"[49.9, 49.9, 49.9]","[0, 0, 0]"
228,Cowley (PIVOTED POWER LLP),NGET,Energy Storage System,BESS / Energy Park,9.0,1;1;1,[207],49.9,0.0,0.0,"[49.9, 49.9, 49.9]","[0, 0, 0]"
229,Lister Drive Shaw (Carnegie BES Limited),NGET,Energy Storage System,BESS / Energy Park,9.0,1;1;1,"[405, 483]",57.0,0.0,0.0,"[57.0, 57.0, 57.0]","[0, 0, 0]"
230,Cuxton 49.5MW BESS (Cuxton Energy Storage Limited),NGET,Energy Storage System,BESS / Energy Park,9.0,1;1;1,[21],49.5,0.0,0.0,"[49.5, 49.5, 49.5]","[0, 0, 0]"
231,Weirs Drove *Stage: 2.0* (EAST ANGLIA GRID STORAGE ONE LIMITED),NGET,Energy Storage System,BESS / Energy Park,9.0,1;1;1,[24],30.0,0.0,0.0,"[30.0, 30.0, 30.0]","[0, 0, 0]"
232,Weirs Drove *Stage: 1.0* (EAST ANGLIA GRID STORAGE ONE LIMITED),NGET,Energy Storage System,BESS / Energy Park,9.0,1;1;1,[24],49.9,0.0,0.0,"[49.9, 49.9, 49.9]","[0, 0, 0]"
233,Tees CCPP *Stage: 2.0* (SEMBCORP UTILITIES (UK) LIMITED),NGET,Energy Storage System; OCGT (Open Cycle Gas Turbine),CCGT/CHP/Biomass,9.0,1;1;1,[472],210.0,0.0,0.0,"[210.0, 210.0, 210.0]","[0, 0, 0]"
234,Nursling Tertiary (NURSLING ENERGY TWO LIMITED),NGET,Energy Storage System,BESS / Energy Park,9.0,1;1;1,"[80, 292]",49.9,0.0,0.0,"[49.9, 49.9, 49.9]","[0, 0, 0]"
235,Ocker Hill Tertiary Connection (HD143OCK LTD),NGET,Energy Storage System,BESS / Energy Park,9.0,1;1;1,"[366, 460]",57.0,0.0,0.0,"[57.0, 57.0, 57.0]","[0, 0, 0]"
236,Oldbury (Tertiary) (PIVOTED POWER LLP),NGET,Energy Storage System,BESS / Energy Park,9.0,1;1;1,"[343, 481]",49.9,0.0,0.0,"[49.9, 49.9, 49.9]","[0, 0, 0]"
237,Warley (WARLEY BATTERY STORAGE),NGET,Energy Storage System,BESS / Energy Park,9.0,1;1;1,[354],57.0,0.0,0.0,"[57.0, 57.0, 57.0]","[0, 0, 0]"
238,Didcot Battery (DIDCOT BATTERY LIMITED),NGET,Demand; Energy Storage System,BESS / Energy Park,9.0,1;1;1,[157],100.0,0.0,0.0,"[100.0, 100.0, 100.0]","[0, 0, 0]"
239,Ouse Energy Storage (Ouse Energy Limited),NGET,Energy Storage System,BESS / Energy Park,9.0,1;1;1,"[135, 288, 289]",249.0,0.0,0.0,"[249.0, 249.0, 249.0]","[0, 0, 0]"
240,Culham Storage (STATERA ENERGY LIMITED),NGET,Energy Storage System,BESS / Energy Park,9.0,1;1;1,[149],500.0,0.0,0.0,"[500.0, 500.0, 500.0]","[0, 0, 0]"
241,Peak Gen Barry (PEAK GEN POWER 6 LIMITED),NGET,Energy Storage System,BESS / Energy Park,9.0,1;1;1,"[681, 708, 714]",20.0,0.0,0.0,"[20.0, 20.0, 20.0]","[0, 0, 0]"
242,Pembroke BESS (RWE GENERATION UK PLC),NGET,Energy Storage System,BESS / Energy Park,9.0,1;1;1,[156],350.0,0.0,0.0,"[350.0, 350.0, 350.0]","[0, 0, 0]"
243,Walpole (PIVOTED POWER LLP),NGET,Energy Storage System,BESS / Energy Park,9.0,1;1;1,[36],49.9,0.0,0.0,"[49.9, 49.9, 49.9]","[0, 0, 0]"
244,Penketh Hall Farm (Net Zero One Limited),NGET,Energy Storage System,BESS / Energy Park,9.0,1;1;1,[387],249.9,0.0,0.0,"[249.9, 249.9, 249.9]","[0, 0, 0]"
245,Penwortham (Redscar) (CONRAD (REDSCAR) LIMITED),NGET,Energy Storage System,BESS / Energy Park,9.0,1;1;1,[771],40.0,0.0,0.0,"[40.0, 40.0, 40.0]","[0, 0, 0]"
246,Richborough 2 (RICHBOROUGH ENERGY PARK LIMITED),NGET,Energy Storage System,BESS / Energy Park,9.0,1;1;1,[164],50.0,0.0,0.0,"[50.0, 50.0, 50.0]","[0, 0, 0]"
247,Penwortham BESS (Penwortham (BES) Ltd),NGET,Energy Storage System,BESS / Energy Park,9.0,1;1;1,"[31, 264, 306]",57.0,0.0,0.0,"[57.0, 57.0, 57.0]","[0, 0, 0]"
248,Pillswood BESS Phase 1 (Harmony (PW) Limited),NGET,Energy Storage System,BESS / Energy Park,9.0,1;1;1,"[677, 784]",49.9,0.0,0.0,"[49.9, 49.9, 49.9]","[0, 0, 0]"
249,Pillswood BESS Phase 2 (Harmony (PW) 2 Limited),NGET,Energy Storage System,BESS / Energy Park,9.0,1;1;1,"[677, 784]",49.9,0.0,0.0,"[49.9, 49.9, 49.9]","[0, 0, 0]"
250,Bradford West 100MW (24 POWER LTD),NGET,Energy Storage System,BESS / Energy Park,9.0,1;1;1,[439],100.0,0.0,0.0,"[100.0, 100.0, 100.0]","[0, 0, 0]"
251,Deeside Power Station (DEESIDE POWER (UK) LIMITED),NGET,Energy Storage System; Reactive Compensation,BESS / Energy Park,9.0,1;1;1,[113],1.0,0.0,0.0,"[1.0, 1.0, 1.0]","[0, 0, 0]"
252,Penwortham BESS (CSE28 LIMITED),NGET,Energy Storage System,BESS / Energy Park,9.0,1;1;1,"[31, 264, 306]",57.0,0.0,0.0,"[57.0, 57.0, 57.0]","[0, 0, 0]"
253,Seabank (Tertiary) (PIVOTED POWER LLP),NGET,Energy Storage System,BESS / Energy Park,9.0,1;1;1,"[47, 111]",49.9,0.0,0.0,"[49.9, 49.9, 49.9]","[0, 0, 0]"
254,Rochdale BESS (Rochdale (BES) Ltd),NGET,Energy Storage System,BESS / Energy Park,9.0,1;1;1,[471],57.0,0.0,0.0,"[57.0, 57.0, 57.0]","[0, 0, 0]"
255,SSE Ferrybridge BESS (SSE UTILITY SOLUTIONS LIMITED),NGET,Energy Storage System,BESS / Energy Park,9.0,1;1;1,[562],150.0,0.0,0.0,"[150.0, 150.0, 150.0]","[0, 0, 0]"
256,SSE Fiddlers Ferry Battery Energy Storage (SSE UTILITY SOLUTIONS LIMITED),NGET,Energy Storage System,BESS / Energy Park,9.0,1;1;1,[387],150.0,0.0,0.0,"[150.0, 150.0, 150.0]","[0, 0, 0]"
257,St Dennis Hendra (SAMBAR POWER LIMITED),NGET,Energy Storage System,BESS / Energy Park,9.0,1;1;1,[175],47.5,0.0,0.0,"[47.5, 47.5, 47.5]","[0, 0, 0]"
258,Steel Point (aka Project Lithium) (Skelmersdale Energy Storage Limited),NGET,Energy Storage System,BESS / Energy Park,9.0,1;1;1,"[737, 746]",49.9,0.0,0.0,"[49.9, 49.9, 49.9]","[0, 0, 0]"
259,Sundon (SUNDON BATTERY STORAGE LIMITED),NGET,Energy Storage System,BESS / Energy Park,9.0,1;1;1,"[297, 300]",49.5,0.0,0.0,"[49.5, 49.5, 49.5]","[0, 0, 0]"
260,Sundon (SUNDON GREEN LIMITED),NGET,Energy Storage System,BESS / Energy Park,9.0,1;1;1,[725],39.9,0.0,0.0,"[39.9, 39.9, 39.9]","[0, 0, 0]"
261,Sundon Pivoted Power (PIVOTED POWER LLP),NGET,Energy Storage System,BESS / Energy Park,9.0,1;1;1,"[297, 300]",49.9,0.0,0.0,"[49.9, 49.9, 49.9]","[0, 0, 0]"
262,Broadditch BESS (Harmony BD Ltd),NGET,Energy Storage System,BESS / Energy Park,9.0,1;1;1,"[559, 592]",11.58,0.0,0.0,"[11.58, 11.58, 11.58]","[0, 0, 0]"
263,Brook Farm BESS (Brook Farm Energy Storage Limited),NGET,Energy Storage System,BESS / Energy Park,9.0,1;1;1,"[616, 731]",49.9,0.0,0.0,"[49.9, 49.9, 49.9]","[0, 0, 0]"
264,Swansea Greener Grid Park - Connection 1 *Stage: 1.0* (Swansea Grid Solutions Limited),NGET,Energy Storage System; Reactive Compensation,BESS / Energy Park,9.0,1;1;1,"[74, 171, 196, 256]",12.0,0.0,0.0,"[12.0, 12.0, 12.0]","[0, 0, 0]"
265,Swansea Greener Grid Park - Connection 1 *Stage: 2.0* (Swansea Grid Solutions Limited),NGET,Energy Storage System; Reactive Compensation,BESS / Energy Park,9.0,1;1;1,"[74, 171, 196, 256]",85.0,0.0,0.0,"[85.0, 85.0, 85.0]","[0, 0, 0]"
266,Bustleholme (PIVOTED POWER LLP),NGET,Energy Storage System,BESS / Energy Park,9.0,1;1;1,[769],49.9,0.0,0.0,"[49.9, 49.9, 49.9]","[0, 0, 0]"
267,Swansea North (PIVOTED POWER LLP),NGET,Energy Storage System,BESS / Energy Park,9.0,1;1;1,"[74, 171, 196, 256]",49.9,0.0,0.0,"[49.9, 49.9, 49.9]","[0, 0, 0]"
268,Tees CCPP *Stage: 5.0* (SEMBCORP UTILITIES (UK) LIMITED),NGET,Energy Storage System; OCGT (Open Cycle Gas Turbine),CCGT/CHP/Biomass,9.0,1;1;1,[472],275.0,0.0,0.0,"[275.0, 275.0, 275.0]","[0, 0, 0]"
269,Tees CCPP *Stage: 4.0* (SEMBCORP UTILITIES (UK) LIMITED),NGET,Energy Storage System; OCGT (Open Cycle Gas Turbine),CCGT/CHP/Biomass,9.0,1;1;1,[472],490.0,0.0,0.0,"[490.0, 490.0, 490.0]","[0, 0, 0]"
270,Burbo Bank Offshore Wind Farm (ORSTED BURBO (UK) LIMITED),NGET,Energy Storage System; Wind Offshore,Wind,9.0,1;1;1,[380],90.0,0.0,0.0,"[90.0, 90.0, 90.0]","[0, 0, 0]"
271,Bumpers Farm BESS phase 2 (Harmony BF Ltd),NGET,Energy Storage System,BESS / Energy Park,9.0,1;1;1,[624],49.5,0.0,0.0,"[49.5, 49.5, 49.5]","[0, 0, 0]"
272,Bumpers Farm BESS phase 1 (Harmony BF Ltd),NGET,Energy Storage System,BESS / Energy Park,9.0,1;1;1,[624],49.5,0.0,0.0,"[49.5, 49.5, 49.5]","[0, 0, 0]"
273,Tees CCPP *Stage: 1.0* (SEMBCORP UTILITIES (UK) LIMITED),NGET,Energy Storage System; OCGT (Open Cycle Gas Turbine),CCGT/CHP/Biomass,9.0,1;1;1,[472],150.0,0.0,0.0,"[150.0, 150.0, 150.0]","[0, 0, 0]"
274,Spennymoor Greener Grid Park *Stage: 1.0* (STATKRAFT UK LTD),NGET,Energy Storage System; Reactive Compensation,BESS / Energy Park,9.0,1;1;1,"[93, 294]",0.0,0.0,0.0,"[0.0, 0.0, 0.0]","[0, 0, 0]"
275,Spennymoor (PIVOTED POWER LLP),NGET,Energy Storage System,BESS / Energy Park,9.0,1;1;1,"[93, 294]",49.9,0.0,0.0,"[49.9, 49.9, 49.9]","[0, 0, 0]"
276,Spalding Energy Expansion *Stage: 1.0* (SPALDING ENERGY EXPANSION LIMITED),NGET,Energy Storage System; OCGT (Open Cycle Gas Turbine),CCGT/CHP/Biomass,9.0,1;1;1,[121],299.99,0.0,0.0,"[299.99, 299.99, 299.99]","[0, 0, 0]"
277,Southfields Farm (PD300RON Ltd),NGET,Energy Storage System,BESS / Energy Park,9.0,1;1;1,[158],47.5,0.0,0.0,"[47.5, 47.5, 47.5]","[0, 0, 0]"
278,Tottenham (PIVOTED POWER LLP),NGET,Energy Storage System,BESS / Energy Park,9.0,1;1;1,"[544, 762]",49.9,0.0,0.0,"[49.9, 49.9, 49.9]","[0, 0, 0]"
279,Tollgate 49.5MW BESS (Tollgate Energy Storage Limited),NGET,Energy Storage System,BESS / Energy Park,9.0,1;1;1,"[558, 565, 774]",49.5,0.0,0.0,"[49.5, 49.5, 49.5]","[0, 0, 0]"
280,Bredbury (PIVOTED POWER LLP),NGET,Energy Storage System,BESS / Energy Park,9.0,1;1;1,[434],49.9,0.0,0.0,"[49.9, 49.9, 49.9]","[0, 0, 0]"
281,Clay Tye Farm Phase 2 (Harmony CTF 2 Limited),NGET,Energy Storage System,BESS / Energy Park,9.0,1;1;1,[581],49.5,0.0,0.0,"[49.5, 49.5, 49.5]","[0, 0, 0]"
282,Clay Tye Farm Phase 1 (HARMONY CTF LIMITED),NGET,Energy Storage System,BESS / Energy Park,9.0,1;1;1,[581],49.5,0.0,0.0,"[49.5, 49.5, 49.5]","[0, 0, 0]"
283,Clayhill Farm (ARL O09 LIMITED),NGET,Energy Storage System,BESS / Energy Park,9.0,1;1;1,[725],40.0,0.0,0.0,"[40.0, 40.0, 40.0]","[0, 0, 0]"
284,Didcot Road (ARLINGTON ENERGY (DEVELOPMENT) LIMITED),NGET,Energy Storage System,BESS / Energy Park,9.0,1;1;1,[157],300.0,0.0,0.0,"[300.0, 300.0, 300.0]","[0, 0, 0]"
285,Sellindge (Tertiary) (PIVOTED POWER LLP),NGET,Energy Storage System,BESS / Energy Park,9.0,1;1;1,"[86, 214, 251, 252, 284, 313]",49.9,0.0,0.0,"[49.9, 49.9, 49.9]","[0, 0, 0]"
286,Bridgwater 2 (tertiary) - New Conn (ENSO GREEN HOLDINGS LIMITED),NGET,Energy Storage System,BESS / Energy Park,9.0,1;1;1,"[57, 192, 202, 271, 320]",54.0,0.0,0.0,"[54.0, 54.0, 54.0]","[0, 0, 0]"
287,CONTEGO  Battery Storage Project (Harmony CS Ltd),NGET,Energy Storage System,BESS / Energy Park,9.0,1;1;1,"[579, 777]",35.8,0.0,0.0,"[35.8, 35.8, 35.8]","[0, 0, 0]"
288,Chapel Farm Battery Storage Project (HARMONY CF LIMITED),NGET,Energy Storage System,BESS / Energy Park,9.0,1;1;1,[725],49.5,0.0,0.0,"[49.5, 49.5, 49.5]","[0, 0, 0]"
289,Cellarhead Home Farm (ECODEV GROUP LTD),NGET,Energy Storage System,BESS / Energy Park,9.0,1;1;1,"[536, 688]",280.0,0.0,0.0,"[280.0, 280.0, 280.0]","[0, 0, 0]"
290,Thurrock Power Station (THURROCK POWER LIMITED),NGET,Energy Storage System; Gas Reciprocating,CCGT/CHP/Biomass,9.0,1;1;1,[342],750.0,0.0,0.0,"[750.0, 750.0, 750.0]","[0, 0, 0]"
291,Cellarhead 400kV Energy Storage (C & S ENERGY LIMITED),NGET,Energy Storage System,BESS / Energy Park,9.0,1;1;1,[182],300.0,0.0,0.0,"[300.0, 300.0, 300.0]","[0, 0, 0]"
292,Sizing John (Rainhill) *Stage: 1.0* (SIZING JOHN LIMITED),NGET,Energy Storage System,BESS / Energy Park,9.0,1;1;1,"[644, 661]",57.0,0.0,0.0,"[57.0, 57.0, 57.0]","[0, 0, 0]"
293,Sizing John (Rainhill) *Stage: 2.0* (SIZING JOHN LIMITED),NGET,Energy Storage System,BESS / Energy Park,9.0,1;1;1,"[644, 661]",85.5,0.0,0.0,"[85.5, 85.5, 85.5]","[0, 0, 0]"
294,Carrington (PIVOTED POWER LLP),NGET,Energy Storage System,BESS / Energy Park,9.0,1;1;1,[526],57.0,0.0,0.0,"[57.0, 57.0, 57.0]","[0, 0, 0]"
295,Capenhurst Tertiary Connection (HD888CAP LIMITED),NGET,Energy Storage System,BESS / Energy Park,9.0,1;1;1,[502],57.0,0.0,0.0,"[57.0, 57.0, 57.0]","[0, 0, 0]"
296,Capenhurst 275KV Substation (ZENOBE CAPENHURST LIMITED),NGET,Energy Storage System,BESS / Energy Park,9.0,1;1;1,[502],100.0,0.0,0.0,"[100.0, 100.0, 100.0]","[0, 0, 0]"
297,Thorpe Marsh Energy Park (Banks Renewables Limited),NGET,Energy Storage System,BESS / Energy Park,9.0,1;1;1,"[141, 283]",1400.0,0.0,0.0,"[1400.0, 1400.0, 1400.0]","[0, 0, 0]"
298,Sheaf Energy (SHEAF ENERGY LIMITED),NGET,Energy Storage System,BESS / Energy Park,9.0,1;1;1,[164],249.0,0.0,0.0,"[249.0, 249.0, 249.0]","[0, 0, 0]"
299,WELBAR ENERGY STORAGE *Stage: 1.0* (WELBAR ENERGY STORAGE LIMITED),NGET,Energy Storage System,BESS / Energy Park,9.0,1;1;1,[269],349.9,0.0,0.0,"[349.9, 349.9, 349.9]","[0, 0, 0]"
300,Didcot Energy Park (RNA-ENERGY LTD),NGET,Energy Storage System,BESS / Energy Park,9.0,1;1;1,[157],300.0,0.0,0.0,"[300.0, 300.0, 300.0]","[0, 0, 0]"
301,Ninfield Greener Grid Park *Stage: 1.0* (STATKRAFT UK LTD),NGET,Energy Storage System; Reactive Compensation,BESS / Energy Park,9.0,1;1;1,[296],0.0,0.0,0.0,"[0.0, 0.0, 0.0]","[0, 0, 0]"
302,Wymondley (PIVOTED POWER LLP),NGET,Energy Storage System,BESS / Energy Park,9.0,1;1;1,[307],57.0,0.0,0.0,"[57.0, 57.0, 57.0]","[0, 0, 0]"
303,Kemsley (PIVOTED POWER LLP),NGET,Energy Storage System,BESS / Energy Park,9.0,1;1;1,"[135, 288, 289]",49.9,0.0,0.0,"[49.9, 49.9, 49.9]","[0, 0, 0]"
304,Feckenham Greener Grid Park *Stage: 1.0* (STATKRAFT UK LTD),NGET,Energy Storage System; Reactive Compensation,BESS / Energy Park,9.0,1;1;1,[198],12.0,0.0,0.0,"[12.0, 12.0, 12.0]","[0, 0, 0]"
305,Fairholme BESS (HB411MIN Limited),NGET,Energy Storage System,BESS / Energy Park,9.0,1;1;1,[158],47.5,0.0,0.0,"[47.5, 47.5, 47.5]","[0, 0, 0]"
306,Kingsnorth *Stage: 1.0* (ENSO GREEN HOLDINGS G LIMITED),NGET,Energy Storage System,BESS / Energy Park,9.0,1;1;1,[21],49.9,0.0,0.0,"[49.9, 49.9, 49.9]","[0, 0, 0]"
307,Kingsnorth *Stage: 2.0* (ENSO GREEN HOLDINGS G LIMITED),NGET,Energy Storage System,BESS / Energy Park,9.0,1;1;1,[21],49.9,0.0,0.0,"[49.9, 49.9, 49.9]","[0, 0, 0]"
308,Kingsnorth *Stage: 3.0* (ENSO GREEN HOLDINGS G LIMITED),NGET,Energy Storage System,BESS / Energy Park,9.0,1;1;1,[21],20.2,0.0,0.0,"[20.2, 20.2, 20.2]","[0, 0, 0]"
