,Customer Name,Project Name,Connection Site,Stage,MW Import - Current,MW Export - Current,MW Import - Increase / Decrease,MW Export - Increase / Decrease,MW Import - Total,MW Export - Total,MW Effective From,Project Status,HOST TO,Project No,etys_sub_map,Plant Type,Ranking,Apportion,Generator Name,MW Effective - Import,MW Effective - Export,bus_name_guess,bus_id_guess,bus_name,bus_id,Gen_Type
4,BRITNED DEVELOPMENT LIMITED,Britned,Grain 400kV Substation,,1200,1200,0,0,1200,1200,2000-01-01,Built,NGET,PRO-000280,GRAI4,Interconnector,0,1;0;-0.5,Britned (BRITNED DEVELOPMENT LIMITED),1200,1200,GRAIN,"[259, 260]",GRAIN,[260],Interconnector
7,EIRGRID INTERCONNECTOR DESIGNATED ACTIVITY COMPANY,East West Interconnector,Deeside 400kV Substation,,505,585,0,0,505,585,2000-01-01,Built,NGET,PRO-000284,CONQ4,Interconnector,0,1;0;-0.5,East West Interconnector (EIRGRID INTERCONNECTOR DESIGNATED ACTIVITY COMPANY),505,585,,,CONNAHS QUAY,[153],Interconnector
8,ELECLINK LIMITED,ElecLink,Sellindge 400kV Substation,,1000,1050,0,0,1000,1050,2000-01-01,Built,NGET,PRO-000286,SELL4,Interconnector,0,1;0;-0.5,ElecLink (ELECLINK LIMITED),1000,1050,SELLINDGE,"[615, 616, 617, 618, 619, 620, 621, 622, 623]",SELLINDGE,"[615, 618, 620, 621, 622, 623]",Interconnector
12,NATIONAL GRID INTERCONNECTORS LIMITED,IFA Interconnector,Sellindge 400kV Substation,,1988,1988,0,0,1988,1988,2000-01-01,Built,NGET,PRO-000282,SELL4,Interconnector,0,1;0;-0.5,IFA Interconnector (NATIONAL GRID INTERCONNECTORS LIMITED),1988,1988,SELLINDGE,"[615, 616, 617, 618, 619, 620, 621, 622, 623]",SELLINDGE,"[615, 618, 620, 621, 622, 623]",Interconnector
13,NATIONAL GRID IFA 2 LIMITED,IFA2 Interconnector,Chilling 400kV Substation,,1100,1150,0,0,1100,1150,2000-01-01,Built,NGET,PRO-000283,CHIL4,Interconnector,0,1;0;-0.5,IFA2 Interconnector (NATIONAL GRID IFA 2 LIMITED),1100,1150,CHILLING,[145],CHILLING,[145],Interconnector
14,MANX UTILITIES,Isle of Man Interconnector,Bispham 132kV Substation,,74,74,0,0,74,74,2000-01-01,Built,NGET,PRO-001291,PEWO2,Interconnector,0,1;0;-0.5,Isle of Man Interconnector (MANX UTILITIES),74,74,,,PENWORTHAM,"[542, 544, 545, 547]",Interconnector
20,NATIONAL GRID NORTH SEA LINK LIMITED,NS Link,Blyth GSP,,1400,1480,0,0,1400,1480,2000-01-01,Built,NGET,PRO-000975,BLYT4,Interconnector,0,1;0;-0.5,NS Link (NATIONAL GRID NORTH SEA LINK LIMITED),1400,1480,BLYTH,"[48, 49, 50, 51, 52, 53, 54]",BLYTH,[53],Interconnector
22,NEMO LINK LIMITED,Nemo Link,Richborough 400kV Substation,,1020,1046,0,0,1020,1046,2000-01-01,Built,NGET,PRO-000974,RICH4,Interconnector,0,1;0;-0.5,Nemo Link (NEMO LINK LIMITED),1020,1046,RICHBOROUGH,"[579, 580]",RICHBOROUGH,[580],Interconnector
